{
  "expected_outcome_schema_version": "1.0.0",
  "case_id": "TC-04",
  "expected_terminal_outcome": "no_recommendation",
  "expected_primary_stage": "STG-03",
  "expected_component": "service_alignment_engine",
  "expected_reason_codes": [
    "STRUCTURED_ANALYSIS_INSUFFICIENT"
  ],
  "expected_human_route": "Opportunity Analyst",
  "expected_audit_events": [
    "source_ingested",
    "alignment_completed",
    "recommendation_abstained"
  ],
  "required_evidence_classes": [
    "opportunity_provenance",
    "deterministic_alignment",
    "audit_chain"
  ],
  "must_occur": [
    "Abstention is explicit and machine-readable.",
    "Missing fields are preserved."
  ],
  "must_not_occur": [
    "No directional recommendation is produced.",
    "No fields are silently inferred.",
    "No fabricated service match appears."
  ],
  "acceptance_target_ids": [
    "AT-02",
    "AT-03",
    "AT-04",
    "AT-18"
  ],
  "safeguard_control_ids": [
    "SG-009",
    "SG-018",
    "SG-021"
  ],
  "assertions": [
    {
      "assertion_id": "AS-TC-04-TERM",
      "assertion_type": "equals",
      "target_path": "$.case_state.terminal_outcome",
      "expected_value": "no_recommendation",
      "severity": "critical"
    },
    {
      "assertion_id": "AS-TC-04-STAGE",
      "assertion_type": "equals",
      "target_path": "$.case_state.primary_stage",
      "expected_value": "STG-03",
      "severity": "critical"
    },
    {
      "assertion_id": "AS-TC-04-COMP",
      "assertion_type": "equals",
      "target_path": "$.case_state.primary_component",
      "expected_value": "service_alignment_engine",
      "severity": "major"
    },
    {
      "assertion_id": "AS-TC-04-REASON",
      "assertion_type": "contains_all",
      "target_path": "$.case_state.reason_codes",
      "expected_value": [
        "STRUCTURED_ANALYSIS_INSUFFICIENT"
      ],
      "severity": "critical"
    },
    {
      "assertion_id": "AS-TC-04-AUDIT",
      "assertion_type": "contains_all",
      "target_path": "$.audit.event_types",
      "expected_value": [
        "source_ingested",
        "alignment_completed",
        "recommendation_abstained"
      ],
      "severity": "major"
    },
    {
      "assertion_id": "AS-TC-04-SCHEMA",
      "assertion_type": "schema_valid",
      "target_path": "$.artifacts",
      "expected_value": true,
      "severity": "critical"
    },
    {
      "assertion_id": "AS-TC-04-CHECK",
      "assertion_type": "checksum_valid",
      "target_path": "$.input_manifest",
      "expected_value": true,
      "severity": "critical"
    },
    {
      "assertion_id": "AS-TC-04-NOEXT",
      "assertion_type": "contains_none",
      "target_path": "$.side_effects",
      "expected_value": [
        "email_sent",
        "proposal_submitted",
        "contract_accepted",
        "purchase_executed",
        "staff_committed"
      ],
      "severity": "critical"
    },
    {
      "assertion_id": "AS-TC-04-BOUND",
      "assertion_type": "contains_none",
      "target_path": "$.claims",
      "expected_value": [
        "production_ready",
        "legally_authoritative",
        "award_probability",
        "autonomous_approval"
      ],
      "severity": "critical"
    },
    {
      "assertion_id": "AS-TC-04-ROUTE",
      "assertion_type": "equals",
      "target_path": "$.routing.expected_human_route",
      "expected_value": "Opportunity Analyst",
      "severity": "major"
    }
  ],
  "result_status": "not_executed_target_only"
}
