{
  "expected_outcome_schema_version": "1.0.0",
  "case_id": "TC-16",
  "expected_terminal_outcome": "failed_closed",
  "expected_primary_stage": "STG-01",
  "expected_component": "profile_loader",
  "expected_reason_codes": [
    "SECRET_VALUE_DETECTED",
    "SENSITIVE_AUDIT_CONTENT_DETECTED"
  ],
  "expected_human_route": "Technical or Security Reviewer",
  "expected_audit_events": [
    "processing_failed"
  ],
  "required_evidence_classes": [
    "organization_configuration",
    "policy_validation",
    "audit_chain"
  ],
  "must_occur": [
    "Secret detection identifies the artifact without persisting the secret.",
    "Case fails closed before normal processing."
  ],
  "must_not_occur": [
    "Secret value is not copied to output or audit.",
    "No repository artifact contains the raw credential."
  ],
  "acceptance_target_ids": [
    "AT-07",
    "AT-09",
    "AT-10",
    "AT-17"
  ],
  "safeguard_control_ids": [
    "SG-007",
    "SG-027"
  ],
  "assertions": [
    {
      "assertion_id": "AS-TC-16-TERM",
      "assertion_type": "equals",
      "target_path": "$.case_state.terminal_outcome",
      "expected_value": "failed_closed",
      "severity": "critical"
    },
    {
      "assertion_id": "AS-TC-16-STAGE",
      "assertion_type": "equals",
      "target_path": "$.case_state.primary_stage",
      "expected_value": "STG-01",
      "severity": "critical"
    },
    {
      "assertion_id": "AS-TC-16-COMP",
      "assertion_type": "equals",
      "target_path": "$.case_state.primary_component",
      "expected_value": "profile_loader",
      "severity": "major"
    },
    {
      "assertion_id": "AS-TC-16-REASON",
      "assertion_type": "contains_all",
      "target_path": "$.case_state.reason_codes",
      "expected_value": [
        "SECRET_VALUE_DETECTED",
        "SENSITIVE_AUDIT_CONTENT_DETECTED"
      ],
      "severity": "critical"
    },
    {
      "assertion_id": "AS-TC-16-AUDIT",
      "assertion_type": "contains_all",
      "target_path": "$.audit.event_types",
      "expected_value": [
        "processing_failed"
      ],
      "severity": "major"
    },
    {
      "assertion_id": "AS-TC-16-SCHEMA",
      "assertion_type": "schema_valid",
      "target_path": "$.artifacts",
      "expected_value": true,
      "severity": "critical"
    },
    {
      "assertion_id": "AS-TC-16-CHECK",
      "assertion_type": "checksum_valid",
      "target_path": "$.input_manifest",
      "expected_value": true,
      "severity": "critical"
    },
    {
      "assertion_id": "AS-TC-16-NOEXT",
      "assertion_type": "contains_none",
      "target_path": "$.side_effects",
      "expected_value": [
        "email_sent",
        "proposal_submitted",
        "contract_accepted",
        "purchase_executed",
        "staff_committed"
      ],
      "severity": "critical"
    },
    {
      "assertion_id": "AS-TC-16-BOUND",
      "assertion_type": "contains_none",
      "target_path": "$.claims",
      "expected_value": [
        "production_ready",
        "legally_authoritative",
        "award_probability",
        "autonomous_approval"
      ],
      "severity": "critical"
    },
    {
      "assertion_id": "AS-TC-16-ROUTE",
      "assertion_type": "equals",
      "target_path": "$.routing.expected_human_route",
      "expected_value": "Technical or Security Reviewer",
      "severity": "major"
    }
  ],
  "result_status": "not_executed_target_only"
}
