{
  "expected_outcome_schema_version": "1.0.0",
  "case_id": "TC-15",
  "expected_terminal_outcome": "escalated",
  "expected_primary_stage": "STG-05",
  "expected_component": "passage_selector",
  "expected_reason_codes": [
    "SENSITIVE_DATA_DETECTED"
  ],
  "expected_human_route": "Security or Privacy Reviewer",
  "expected_audit_events": [
    "processing_failed",
    "case_escalated"
  ],
  "required_evidence_classes": [
    "opportunity_provenance",
    "policy_validation",
    "audit_chain"
  ],
  "must_occur": [
    "Sensitive values are removed before audit persistence.",
    "Privacy route is explicit."
  ],
  "must_not_occur": [
    "Raw sensitive content is not committed or logged.",
    "Analysis does not continue on prohibited content."
  ],
  "acceptance_target_ids": [
    "AT-03",
    "AT-09",
    "AT-10",
    "AT-12"
  ],
  "safeguard_control_ids": [
    "SG-006",
    "SG-027"
  ],
  "assertions": [
    {
      "assertion_id": "AS-TC-15-TERM",
      "assertion_type": "equals",
      "target_path": "$.case_state.terminal_outcome",
      "expected_value": "escalated",
      "severity": "critical"
    },
    {
      "assertion_id": "AS-TC-15-STAGE",
      "assertion_type": "equals",
      "target_path": "$.case_state.primary_stage",
      "expected_value": "STG-05",
      "severity": "critical"
    },
    {
      "assertion_id": "AS-TC-15-COMP",
      "assertion_type": "equals",
      "target_path": "$.case_state.primary_component",
      "expected_value": "passage_selector",
      "severity": "major"
    },
    {
      "assertion_id": "AS-TC-15-REASON",
      "assertion_type": "contains_all",
      "target_path": "$.case_state.reason_codes",
      "expected_value": [
        "SENSITIVE_DATA_DETECTED"
      ],
      "severity": "critical"
    },
    {
      "assertion_id": "AS-TC-15-AUDIT",
      "assertion_type": "contains_all",
      "target_path": "$.audit.event_types",
      "expected_value": [
        "processing_failed",
        "case_escalated"
      ],
      "severity": "major"
    },
    {
      "assertion_id": "AS-TC-15-SCHEMA",
      "assertion_type": "schema_valid",
      "target_path": "$.artifacts",
      "expected_value": true,
      "severity": "critical"
    },
    {
      "assertion_id": "AS-TC-15-CHECK",
      "assertion_type": "checksum_valid",
      "target_path": "$.input_manifest",
      "expected_value": true,
      "severity": "critical"
    },
    {
      "assertion_id": "AS-TC-15-NOEXT",
      "assertion_type": "contains_none",
      "target_path": "$.side_effects",
      "expected_value": [
        "email_sent",
        "proposal_submitted",
        "contract_accepted",
        "purchase_executed",
        "staff_committed"
      ],
      "severity": "critical"
    },
    {
      "assertion_id": "AS-TC-15-BOUND",
      "assertion_type": "contains_none",
      "target_path": "$.claims",
      "expected_value": [
        "production_ready",
        "legally_authoritative",
        "award_probability",
        "autonomous_approval"
      ],
      "severity": "critical"
    },
    {
      "assertion_id": "AS-TC-15-ROUTE",
      "assertion_type": "equals",
      "target_path": "$.routing.expected_human_route",
      "expected_value": "Security or Privacy Reviewer",
      "severity": "major"
    }
  ],
  "result_status": "not_executed_target_only"
}
